{
  "$schema": "https://github.com/jj-ervin/core-economy/schema/industry-endpoint.schema.json",
  "version": "0.4.1",
  "horizon": {"start": 1700, "end": 2299},
  "endpoint_semantics": "An industry family must have explicit coverage through 2299. A terminal record may continue, transform, decline, or phase out. The endpoint contract supplies the campaign-horizon disposition even when a legacy record's era field ends earlier.",
  "terminal_industries": {
    "AGR_FARM_AUTO": {"action":"continue","coverage_end":2299},
    "FOR_PREC": {"action":"continue","coverage_end":2299},
    "FIS_ADV": {"action":"continue","coverage_end":2299},
    "MIN_COAL_MOD": {"action":"transform","coverage_end":2299},
    "MIN_IRON_MECH": {"action":"continue","coverage_end":2299},
    "MIN_COPPER_AUTO": {"action":"continue","coverage_end":2299},
    "MIN_QUARRY": {"action":"continue","coverage_end":2299},
    "MIN_CLAY": {"action":"continue","coverage_end":2299},
    "MIN_OIL_ON": {"action":"transform","coverage_end":2299},
    "MIN_GAS_ON": {"action":"transform","coverage_end":2299},
    "PRC_COKE": {"action":"continue","coverage_end":2299},
    "PRC_STEEL_ADV": {"action":"continue","coverage_end":2299},
    "PRC_COPPER_ADV": {"action":"continue","coverage_end":2299},
    "PRC_GLASS": {"action":"continue","coverage_end":2299},
    "PRC_CERAMICS": {"action":"continue","coverage_end":2299},
    "PRC_ALUMINUM": {"action":"continue","coverage_end":2299},
    "PRC_TITANIUM": {"action":"continue","coverage_end":2299},
    "PRC_PRECIOUS_METALS": {"action":"continue","coverage_end":2299},
    "PRC_RARE_EARTH": {"action":"continue","coverage_end":2299},
    "PRC_FOOD_ADV": {"action":"continue","coverage_end":2299},
    "PRC_SAWMILL_AUTO": {"action":"continue","coverage_end":2299},
    "PRC_REFINERY_ADV": {"action":"transform","coverage_end":2299},
    "PRC_CHEM_ADV": {"action":"continue","coverage_end":2299},
    "MFG_MACH_ADV": {"action":"continue","coverage_end":2299},
    "MFG_FACTORY_ADV": {"action":"continue","coverage_end":2299},
    "MFG_ELECTRONICS_ADV": {"action":"continue","coverage_end":2299},
    "MFG_ADVANCED": {"action":"continue","coverage_end":2299},
    "SUP_CONSTRUCTION": {"action":"continue","coverage_end":2299},
    "SUP_TOOLS": {"action":"continue","coverage_end":2299},
    "SUP_INDUSTRIAL": {"action":"continue","coverage_end":2299},
    "SUP_AGRICULTURE": {"action":"continue","coverage_end":2299},
    "SUP_FUEL": {"action":"transform","coverage_end":2299},
    "SUP_TECH": {"action":"continue","coverage_end":2299},
    "OFF_PLATFORM_OIL": {"action":"transform","coverage_end":2299},
    "OFF_PLATFORM_ADV": {"action":"continue","coverage_end":2299},
    "POR_TRADING": {"action":"continue","coverage_end":2299},
    "POR_COMMERCIAL": {"action":"continue","coverage_end":2299},
    "POR_INDUSTRIAL": {"action":"continue","coverage_end":2299},
    "POR_FISHING": {"action":"continue","coverage_end":2299},
    "POR_DEEPWATER": {"action":"continue","coverage_end":2299},
    "POR_CONTAINER": {"action":"continue","coverage_end":2299},
    "POR_MEGA": {"action":"continue","coverage_end":2299},
    "OFF_SUPPLY_BASE": {"action":"continue","coverage_end":2299},
    "FIN_SYSTEM": {"action":"continue","coverage_end":2299}
  }
}
